{
  "format": "sao-evidence-pack",
  "version": "0.1",
  "incident_id": "demo-customer-replication-missing-event",
  "kind": "master-data-replication",
  "object": {
    "type": "customer",
    "source_id": "C-100",
    "target_id": "BP-501"
  },
  "authority": {
    "system": "MDG",
    "attribute": "delivery_control"
  },
  "files": {
    "source_changes": "source_changes.csv",
    "messages": "messages.csv",
    "target_state": "target_state.csv",
    "identity_map": "identity_map.csv"
  },
  "recovery": {
    "regeneration_supported": true
  },
  "resolution_condition": "Target BP-501 contains delivery_control=NEW and the observed target state is causally traceable to the current MDG change CHG-200."
}
